{
  "$schema": "http://json-schema.org/draft-07/schema#",
  "type": "object",
  "required": ["number", "date", "seller", "buyer", "items", "totals", "total_words"],
  "properties": {
    "number": {"type": "string", "minLength": 1},
    "date": {"type": "string", "pattern": "^\\d{2}\\.\\d{2}\\.\\d{4}$"},
    "seller": {"$ref": "#/definitions/party"},
    "buyer": {"$ref": "#/definitions/party"},
    "items": {"type": "array", "minItems": 1, "items": {
      "type": "object",
      "required": ["name", "unit", "qty", "price", "amount", "vat_rate", "vat_amount", "total_with_vat"],
      "properties": {
        "name": {"type": "string"}, "unit": {"type": "string"}, "qty": {"type": "string"},
        "price": {"type": "string"}, "amount": {"type": "string"},
        "vat_rate": {"type": "string"}, "vat_amount": {"type": "string"},
        "total_with_vat": {"type": "string"}
      }}},
    "totals": {
      "type": "object",
      "required": ["amount", "vat", "with_vat"],
      "properties": {
        "amount": {"type": "string"}, "vat": {"type": "string"}, "with_vat": {"type": "string"}
      }},
    "total_words": {"type": "string"}
  },
  "definitions": {
    "party": {
      "type": "object",
      "required": ["name", "identifier"],
      "properties": {
        "name": {"type": "string"}, "identifier": {"type": "string"},
        "address": {"type": "string"}, "iik": {"type": "string"},
        "bik": {"type": "string"}, "bank": {"type": "string"}, "kbe": {"type": "string"},
        "vat_certificate": {"type": "string"}
      }}
  }
}
