{
  "number": "SF-58",
  "date": "14.08.2026",
  "seller": {
    "name": "Cyber Capybara ТОО",
    "identifier": "104332181962",
    "address": "г. Алматы, ул. Абая, 150, оф. 12",
    "iik": "KZ123456789012345678",
    "bik": "HSBKKZKX",
    "bank": "АО «Народный Банк Казахстана»",
    "kbe": "17",
    "vat_certificate": "Серия 062100 № 0037845 от 01.02.2020"
  },
  "buyer": {
    "name": "ИП Серикбаев А.К.",
    "identifier": "001338908381",
    "address": "г. Астана, пр. Мангилик Ел, 55",
    "vat_certificate": "Серия 062100 № 0041233 от 15.03.2021"
  },
  "items": [
    {
      "name": "Услуги доступа к серверу",
      "unit": "усл",
      "qty": "1",
      "price": "50 000,00",
      "amount": "50 000,00",
      "vat_rate": "16%",
      "vat_amount": "8 000,00",
      "total_with_vat": "58 000,00"
    },
    {
      "name": "Техническая поддержка",
      "unit": "мес",
      "qty": "2",
      "price": "20 000,00",
      "amount": "40 000,00",
      "vat_rate": "16%",
      "vat_amount": "6 400,00",
      "total_with_vat": "46 400,00"
    }
  ],
  "totals": {
    "amount_tiyn": 9000000,
    "vat_tiyn": 1440000,
    "with_vat_tiyn": 10440000,
    "amount": "90 000,00",
    "vat": "14 400,00",
    "with_vat": "104 400,00"
  },
  "total_words": "Сто четыре тысячи четыреста тенге 00 тиын"
}
