{
  "number": "SC-1",
  "date": "14.08.2026",
  "seller": {
    "name": "Продавец Тестов ТОО",
    "identifier": "104332181962"
  },
  "buyer": {
    "name": "Покупатель Тестов ТОО",
    "identifier": "001338908381"
  },
  "items": [
    {
      "name": "50% & \"к\" #1 _t_ {б} \\б $5 ^верх ~тильда <уголки>",
      "unit": "шт",
      "qty": "1",
      "price": "1 000,00",
      "amount": "1 000,00",
      "vat_rate": "16%",
      "vat_amount": "160,00",
      "total_with_vat": "1 160,00"
    }
  ],
  "totals": {
    "amount": "1 000,00",
    "vat": "160,00",
    "with_vat": "1 160,00"
  },
  "total_words": "Одна тысяча сто шестьдесят тенге 00 тиын"
}
